Title,StoreId,AccessionNumber,AlternateTitle,ArticleType,Authors,copyright,documentType,language,languageOfSummary,originalTitle,pages,pubdate,publicationType,year,publisher,DocumentURL,documentFeatures,notes,subjectTerms,subjects,FindACopy,Database
"The English acquisitions in Guinea &amp; East-India containing first, the several forts and castles of the Royal African Company, from Sally in South Barbary, to the Cape of Good Hope in Africa ... secondly, the forts and factories of the Honourable East-India Company in Persia, India, Sumatra, China, &amp;c. ... : with an account of the inhabitants of all these countries ... : also the birds, beasts, serpents and monsters and other strange creatures found there ... : likewise, a description of the Isle of St. Helena, where the English usually refresh in their Indian voyages by R.B.",2240969664, 178:05,,Books,"R. B., 1632?-1725?", Keyboarded and encoded full text © 2003-2004 Early English Books Online Text Creation Partnership. All Rights Reserved., Book, English, English,," [4], 179, [10] p. :",1700, Books,1700, England,https://search.proquest.com/docview/2240969664?accountid=14496, Illustration," ill. , <p>Advertisements: p. [1]-[9] at end.</p><p>Reproduction of original in British Library.</p> , Early English Books, 1641-1700 (Wing)"," Voyages and travels. , Africa - Description and travel. , Asia - Description and travel. , Africa , Asia"," Travel, topography, maps and navigational manuals",http://ucelinks.cdlib.org:8888/sfx_local?url_ver=Z39.88-2004&amp;rft_val_fmt=info:ofi/fmt:kev:mtx:book&amp;genre=book&amp;sid=ProQ:ProQ%3Aeebo&amp;atitle=&amp;title=The+English+acquisitions+in+Guinea+%26+East-India+containing+first%2C+the+several+forts+and+castles+of+the+Royal+African+Company%2C+from+Sally+in+South+Barbary%2C+to+the+Cape+of+Good+Hope+in+Africa+...+secondly%2C+the+forts+and+factories+of+the+Honourable+East-India+Company+in+Persia%2C+India%2C+Sumatra%2C+China%2C+%26c.+...+%3A+with+an+account+of+the+inhabitants+of+all+these+countries+...+%3A+also+the+birds%2C+beasts%2C+serpents+and+monsters+and+other+strange+creatures+found+there+...+%3A+likewise%2C+a+description+of+the+Isle+of+St.+Helena%2C+where+the+English+usually+refresh+in+their+Indian+voyages+by+R.B.&amp;issn=&amp;date=1700-01-01&amp;volume=&amp;issue=&amp;spage=&amp;au=R.+B.%2C+1632%3F-1725%3F&amp;isbn=&amp;jtitle=&amp;btitle=The+English+acquisitions+in+Guinea+%26+East-India+containing+first%2C+the+several+forts+and+castles+of+the+Royal+African+Company%2C+from+Sally+in+South+Barbary%2C+to+the+Cape+of+Good+Hope+in+Africa+...+secondly%2C+the+forts+and+factories+of+the+Honourable+East-India+Company+in+Persia%2C+India%2C+Sumatra%2C+China%2C+%26c.+...+%3A+with+an+account+of+the+inhabitants+of+all+these+countries+...+%3A+also+the+birds%2C+beasts%2C+serpents+and+monsters+and+other+strange+creatures+found+there+...+%3A+likewise%2C+a+description+of+the+Isle+of+St.+Helena%2C+where+the+English+usually+refresh+in+their+Indian+voyages+by+R.B.&amp;rft_id=info:eric/178%3A05&amp;rft_id=info:doi/,Early Modern Books
"Memoirs of the Dutch trade in all the states, kingdoms, and empires in the world shewing its first rise and prodigious progress : after what manner the Dutch manage, and carry on their trade, their dominions and government of the Indies : by what means they have made themselves masters of all the trade of Europe : what goods and merchandise are proper for maritime traffick, whence they are to be had, and what gain and profit they produce : a work very necessary for all merchants, and others concerned in trade / done from the French now printed at Amsterdam.",2240956389, 764:13, Grand trésor historique et politique du florissant commerce des Hollandois dans tous les Etats et empires du monde.,Books,"Huet, Pierre-Daniel, 1630-1721.", Keyboarded and encoded full text © 2003-2004 Early English Books Online Text Creation Partnership. All Rights Reserved., Book, English, English, Grand trésor historique et politique du florissant commerce des Hollandois dans tous les Etats et empires du monde.," [2], xii, [4], 232 p.",1700, Books,1700, England,https://search.proquest.com/docview/2240956389?accountid=14496, Chart," <p>Translation of his Grand trésor historique et politique du florissant commerce des Hollandois dans tous les Etats et empires du monde.</p><p>Imprint has been also dated as [1717].</p><p>Reproduction of original in Huntington Library.</p> , Early English Books, 1641-1700 (Wing)"," Netherlands - Commerce. , Netherlands"," Economics , History and chronicles , Ordinances, edicts, proclamations",http://ucelinks.cdlib.org:8888/sfx_local?url_ver=Z39.88-2004&amp;rft_val_fmt=info:ofi/fmt:kev:mtx:book&amp;genre=book&amp;sid=ProQ:ProQ%3Aeebo&amp;atitle=&amp;title=Memoirs+of+the+Dutch+trade+in+all+the+states%2C+kingdoms%2C+and+empires+in+the+world+shewing+its+first+rise+and+prodigious+progress+%3A+after+what+manner+the+Dutch+manage%2C+and+carry+on+their+trade%2C+their+dominions+and+government+of+the+Indies+%3A+by+what+means+they+have+made+themselves+masters+of+all+the+trade+of+Europe+%3A+what+goods+and+merchandise+are+proper+for+maritime+traffick%2C+whence+they+are+to+be+had%2C+and+what+gain+and+profit+they+produce+%3A+a+work+very+necessary+for+all+merchants%2C+and+others+concerned+in+trade+%2F+done+from+the+French+now+printed+at+Amsterdam.&amp;issn=&amp;date=1700-01-01&amp;volume=&amp;issue=&amp;spage=&amp;au=Huet%2C+Pierre-Daniel%2C+1630-1721.&amp;isbn=&amp;jtitle=&amp;btitle=Memoirs+of+the+Dutch+trade+in+all+the+states%2C+kingdoms%2C+and+empires+in+the+world+shewing+its+first+rise+and+prodigious+progress+%3A+after+what+manner+the+Dutch+manage%2C+and+carry+on+their+trade%2C+their+dominions+and+government+of+the+Indies+%3A+by+what+means+they+have+made+themselves+masters+of+all+the+trade+of+Europe+%3A+what+goods+and+merchandise+are+proper+for+maritime+traffick%2C+whence+they+are+to+be+had%2C+and+what+gain+and+profit+they+produce+%3A+a+work+very+necessary+for+all+merchants%2C+and+others+concerned+in+trade+%2F+done+from+the+French+now+printed+at+Amsterdam.&amp;rft_id=info:eric/764%3A13&amp;rft_id=info:doi/,Early Modern Books
"Of the conversion of five thousand and nine hundred East-Indians in the isle Formosa, neere China, to the profession of the true God, in Jesus Christ; by meanes of M. Ro: Junius, a minister lately in Delph in Holland. / Related by his good friend, M.C. Sibellius, pastor in Daventrie there, in a Latine letter. Translated to further the faith and joy of many here, by Henry Jessei. With a post-script of the Gospels good sucesse also amongst the West-Indians, in New-England.",2240888760, E1:2[171a],,Books,"Sibelius, Caspar, 1590-1658.",, Book, English, English,, [1] p.,1700-1799, Books,1700, England,https://search.proquest.com/docview/2240888760?accountid=14496,," <p>Ms. transcription of t.p. of Wing S3748.</p><p>""London.  P. by Iohn Hammond, and are to be sold at his house over against S. Andrews Church in Holborne; and in Popes-Head-Alley, by H. Allen. 1650.""</p><p>Reproduction of original in the British Library.</p> , Tract Supplement"," Junius, Robert, 1606-1655. , Title pages - England. , Junius, Robert, 1606-1655."," Book industry, catalogues and inventories , Religious",http://ucelinks.cdlib.org:8888/sfx_local?url_ver=Z39.88-2004&amp;rft_val_fmt=info:ofi/fmt:kev:mtx:book&amp;genre=book&amp;sid=ProQ:ProQ%3Aeebo&amp;atitle=&amp;title=Of+the+conversion+of+five+thousand+and+nine+hundred+East-Indians+in+the+isle+Formosa%2C+neere+China%2C+to+the+profession+of+the+true+God%2C+in+Jesus+Christ%3B+by+meanes+of+M.+Ro%3A+Junius%2C+a+minister+lately+in+Delph+in+Holland.+%2F+Related+by+his+good+friend%2C+M.C.+Sibellius%2C+pastor+in+Daventrie+there%2C+in+a+Latine+letter.+Translated+to+further+the+faith+and+joy+of+many+here%2C+by+Henry+Jessei.+With+a+post-script+of+the+Gospels+good+sucesse+also+amongst+the+West-Indians%2C+in+New-England.&amp;issn=&amp;date=1700-01-01&amp;volume=&amp;issue=&amp;spage=&amp;au=Sibelius%2C+Caspar%2C+1590-1658.&amp;isbn=&amp;jtitle=&amp;btitle=Of+the+conversion+of+five+thousand+and+nine+hundred+East-Indians+in+the+isle+Formosa%2C+neere+China%2C+to+the+profession+of+the+true+God%2C+in+Jesus+Christ%3B+by+meanes+of+M.+Ro%3A+Junius%2C+a+minister+lately+in+Delph+in+Holland.+%2F+Related+by+his+good+friend%2C+M.C.+Sibellius%2C+pastor+in+Daventrie+there%2C+in+a+Latine+letter.+Translated+to+further+the+faith+and+joy+of+many+here%2C+by+Henry+Jessei.+With+a+post-script+of+the+Gospels+good+sucesse+also+amongst+the+West-Indians%2C+in+New-England.&amp;rft_id=info:eric/E1%3A2&amp;rft_id=info:doi/,Early Modern Books
"A new list of fifty two ships gone to the East-Indies, in less than two years, with above two millions of bullion : and of fifty ships that went in seven years, from December 1690, to 1697 With a list of twenty six ships belonging to the Old East-India Company; with their tonns, guns, men, and cargoo's [sic]: also an account of ten ships arrived from East-India and China, since the 20th. of May last, with above five hundred thousand pieces of wrought goods ; and of three ships which arrived since the 20th. of January, which have brought in above one hundred thousand pieces of wrought silks, stuffs, and calico's, and not one pound of raw silk. With remarks and queries thereupon.",2240862282, 1856:07,,Books,Anonymous, Keyboarded and encoded full text © 2003-2004 Early English Books Online Text Creation Partnership. All Rights Reserved., Book, English, English,, 1 sheet ([1] p.),1700, Books,1700, England,https://search.proquest.com/docview/2240862282?accountid=14496,," <p>Imprint from Wing.</p><p>Reproduction of the original in the British Library.</p><p>Docket title: A new list of fifty two ships sent to the East-Indies, in less than two years, with above two millions. With several other lists ans accounts : with remarks and queries thereupon.</p> , Early English Books, 1641-1700 (Wing)", Shipping - England - Early works to 1800., Economics,http://ucelinks.cdlib.org:8888/sfx_local?url_ver=Z39.88-2004&amp;rft_val_fmt=info:ofi/fmt:kev:mtx:book&amp;genre=book&amp;sid=ProQ:ProQ%3Aeebo&amp;atitle=&amp;title=A+new+list+of+fifty+two+ships+gone+to+the+East-Indies%2C+in+less+than+two+years%2C+with+above+two+millions+of+bullion+%3A+and+of+fifty+ships+that+went+in+seven+years%2C+from+December+1690%2C+to+1697+With+a+list+of+twenty+six+ships+belonging+to+the+Old+East-India+Company%3B+with+their+tonns%2C+guns%2C+men%2C+and+cargoo%27s+%3A+also+an+account+of+ten+ships+arrived+from+East-India+and+China%2C+since+the+20th.+of+May+last%2C+with+above+five+hundred+thousand+pieces+of+wrought+goods+%3B+and+of+three+ships+which+arrived+since+the+20th.+of+January%2C+which+have+brought+in+above+one+hundred+thousand+pieces+of+wrought+silks%2C+stuffs%2C+and+calico%27s%2C+and+not+one+pound+of+raw+silk.+With+remarks+and+queries+thereupon.&amp;issn=&amp;date=1700-01-01&amp;volume=&amp;issue=&amp;spage=&amp;au=Anonymous&amp;isbn=&amp;jtitle=&amp;btitle=A+new+list+of+fifty+two+ships+gone+to+the+East-Indies%2C+in+less+than+two+years%2C+with+above+two+millions+of+bullion+%3A+and+of+fifty+ships+that+went+in+seven+years%2C+from+December+1690%2C+to+1697+With+a+list+of+twenty+six+ships+belonging+to+the+Old+East-India+Company%3B+with+their+tonns%2C+guns%2C+men%2C+and+cargoo%27s+%3A+also+an+account+of+ten+ships+arrived+from+East-India+and+China%2C+since+the+20th.+of+May+last%2C+with+above+five+hundred+thousand+pieces+of+wrought+goods+%3B+and+of+three+ships+which+arrived+since+the+20th.+of+January%2C+which+have+brought+in+above+one+hundred+thousand+pieces+of+wrought+silks%2C+stuffs%2C+and+calico%27s%2C+and+not+one+pound+of+raw+silk.+With+remarks+and+queries+thereupon.&amp;rft_id=info:eric/1856%3A07&amp;rft_id=info:doi/,Early Modern Books
"A new voyage round the world describing particularly the isthmus of America, several coasts and islands in the West Indies, the isles of Cape Verd, the passage by Terra del Fuego, the South Sea coasts of Chili, Peru, and Mexico, the isle of Guam one of the Ladrones, Mindanaeo, and other Philippine and East India islands near Cambodia, China, Formosa, Luconia, Celebes &amp;c., New Holland, Sumatra, Nicobar Isles, the Cape of Good Hope, and Santa Helena, their soil, rivers, harbours, plants, fruits, animals, and inhabitants, their customs, religion, government, trade &amp;c. / by William Dampier.",2264190968, 1328:40,,Books,"Dampier, William, 1652-1715.",, Book, English, English,," [9], VI, 550 p., [3] leaves of plates :",1699, Books,1699, England,https://search.proquest.com/docview/2264190968?accountid=14496," Chart , Illustration , Map"," maps. , <p>Reproduction of original in the Huntington Library.</p> , <p>The fourth edition corrected.</p> , Early English Books, 1641-1700 (Wing)"," Voyages around the world. , Voyages and travels. , Buccaneers."," Travel, topography, maps and navigational manuals , History and chronicles",http://ucelinks.cdlib.org:8888/sfx_local?url_ver=Z39.88-2004&amp;rft_val_fmt=info:ofi/fmt:kev:mtx:book&amp;genre=book&amp;sid=ProQ:ProQ%3Aeebo&amp;atitle=&amp;title=A+new+voyage+round+the+world+describing+particularly+the+isthmus+of+America%2C+several+coasts+and+islands+in+the+West+Indies%2C+the+isles+of+Cape+Verd%2C+the+passage+by+Terra+del+Fuego%2C+the+South+Sea+coasts+of+Chili%2C+Peru%2C+and+Mexico%2C+the+isle+of+Guam+one+of+the+Ladrones%2C+Mindanaeo%2C+and+other+Philippine+and+East+India+islands+near+Cambodia%2C+China%2C+Formosa%2C+Luconia%2C+Celebes+%26c.%2C+New+Holland%2C+Sumatra%2C+Nicobar+Isles%2C+the+Cape+of+Good+Hope%2C+and+Santa+Helena%2C+their+soil%2C+rivers%2C+harbours%2C+plants%2C+fruits%2C+animals%2C+and+inhabitants%2C+their+customs%2C+religion%2C+government%2C+trade+%26c.+%2F+by+William+Dampier.&amp;issn=&amp;date=1699-01-01&amp;volume=&amp;issue=&amp;spage=&amp;au=Dampier%2C+William%2C+1652-1715.&amp;isbn=&amp;jtitle=&amp;btitle=A+new+voyage+round+the+world+describing+particularly+the+isthmus+of+America%2C+several+coasts+and+islands+in+the+West+Indies%2C+the+isles+of+Cape+Verd%2C+the+passage+by+Terra+del+Fuego%2C+the+South+Sea+coasts+of+Chili%2C+Peru%2C+and+Mexico%2C+the+isle+of+Guam+one+of+the+Ladrones%2C+Mindanaeo%2C+and+other+Philippine+and+East+India+islands+near+Cambodia%2C+China%2C+Formosa%2C+Luconia%2C+Celebes+%26c.%2C+New+Holland%2C+Sumatra%2C+Nicobar+Isles%2C+the+Cape+of+Good+Hope%2C+and+Santa+Helena%2C+their+soil%2C+rivers%2C+harbours%2C+plants%2C+fruits%2C+animals%2C+and+inhabitants%2C+their+customs%2C+religion%2C+government%2C+trade+%26c.+%2F+by+William+Dampier.&amp;rft_id=info:eric/1328%3A40&amp;rft_id=info:doi/,Early Modern Books
"The Present condition of the Muscovite empire till the year 1699 in two letters : the first from a gentleman who was conversant with the Muscovite ambassadour in Holland, the second from a person of quality at Vienna, concerning the late Muscovite embassy, his present czarish majesty, the Russian empire and Great-Tartary : with the life of the present emperour of China, by Father J. Bouvet, missionary / by the author of The antient and present state of Muscovy.",2264188240, 687:06,,Books,Anonymous,, Book, English, English,," [6], 109, [10], 111 p.",1699, Books,1699, England,https://search.proquest.com/docview/2264188240?accountid=14496,," <p>Translated and edited by J. Crull, author of ""The antient and present state of Muscovy."" Cf. BM; DNB.</p><p>""A letter from a person of quality, residing at the imperial court of Vienna, to his friend in London"" (p. [73]-109), and ""The history of Cang-Hy, the present emperour of China pesented [sic] to the Most Christian King by Father J. Bouvet"" ([10], 111 p. at end) each have special t.p.</p><p>Reproduction of originals in British Library and Huntington Library.</p><p>Copies on both reels are imperfect: Reel 172:6 lacks text of ""The history of Cang-Hy"" (111 p.), but includes preliminaries to that text (""Advertisement to the reader"" and ""To the Most Christian King"") bound out of place before ""The present condition of the Muscovite empire ...  Pages [71] and [72] are blank.  Reel 687:6 lacks title page for ""The history of Cang-Hy"" and the relative positions of the 109 p. and 111 p. are reversed.</p><p>Item at 687:6 has Wing number C7428, cancelled in Wing (2nd ed.).</p><p>Other Contributors: Crull, J. d. 1713?; Bouvet, Joachim, 1656-1730.</p> , Early English Books, 1641-1700 (Wing) , <p> 
<object xmlns:pqfn=""http://local/functions"" xmlns:exsl=""http://exslt.org/common"" class=""mstar_link_to_record""><param name=""mstar_record_id_type"" value=""eebo""/><param name=""mstar_record_id"" value=""12258615""/><div class=""mstar_record_link_text"">172:06 The Present condition of the Muscovite empire till the year 1699 in two letters : the first from a gentleman who was conversant with the Muscovite ambassadour in Holland, the second from a person of quality at Vienna, concerning the late Muscovite embassy, his present czarish majesty, the Russian empire and Great-Tartary : with the life of the present emperour of China, by Father J. Bouvet, missionary / by the author of The antient and present state of Muscovy.</div></object></p>"," Russia - History - Peter I, 1689-1725. , Peter I, Emperor of Russia, 1672-1725. , Kangxi, Emperor of China, 1654-1722. , Peter I, Emperor of Russia, 1672-1725. , Kangxi, Emperor of China, 1654-1722. , Russia", History and chronicles,http://ucelinks.cdlib.org:8888/sfx_local?url_ver=Z39.88-2004&amp;rft_val_fmt=info:ofi/fmt:kev:mtx:book&amp;genre=book&amp;sid=ProQ:ProQ%3Aeebo&amp;atitle=&amp;title=The+Present+condition+of+the+Muscovite+empire+till+the+year+1699+in+two+letters+%3A+the+first+from+a+gentleman+who+was+conversant+with+the+Muscovite+ambassadour+in+Holland%2C+the+second+from+a+person+of+quality+at+Vienna%2C+concerning+the+late+Muscovite+embassy%2C+his+present+czarish+majesty%2C+the+Russian+empire+and+Great-Tartary+%3A+with+the+life+of+the+present+emperour+of+China%2C+by+Father+J.+Bouvet%2C+missionary+%2F+by+the+author+of+The+antient+and+present+state+of+Muscovy.&amp;issn=&amp;date=1699-01-01&amp;volume=&amp;issue=&amp;spage=&amp;au=Anonymous&amp;isbn=&amp;jtitle=&amp;btitle=The+Present+condition+of+the+Muscovite+empire+till+the+year+1699+in+two+letters+%3A+the+first+from+a+gentleman+who+was+conversant+with+the+Muscovite+ambassadour+in+Holland%2C+the+second+from+a+person+of+quality+at+Vienna%2C+concerning+the+late+Muscovite+embassy%2C+his+present+czarish+majesty%2C+the+Russian+empire+and+Great-Tartary+%3A+with+the+life+of+the+present+emperour+of+China%2C+by+Father+J.+Bouvet%2C+missionary+%2F+by+the+author+of+The+antient+and+present+state+of+Muscovy.&amp;rft_id=info:eric/687%3A06&amp;rft_id=info:doi/,Early Modern Books
"The Present condition of the Muscovite empire till the year 1699 in two letters : the first from a gentleman who was conversant with the Muscovite ambassadour in Holland, the second from a person of quality at Vienna, concerning the late Muscovite embassy, his present czarish majesty, the Russian empire and Great-Tartary : with the life of the present emperour of China, by Father J. Bouvet, missionary / by the author of The antient and present state of Muscovy.",2248568146, 172:06,,Books,Anonymous, Keyboarded and encoded full text © 2003-2004 Early English Books Online Text Creation Partnership. All Rights Reserved., Book, English, English,," [6], 109, [10], 111 p.",1699, Books,1699, England,https://search.proquest.com/docview/2248568146?accountid=14496,," <p>Translated and edited by J. Crull, author of ""The antient and present state of Muscovy."" Cf. BM; DNB.</p><p>""A letter from a person of quality, residing at the imperial court of Vienna, to his friend in London"" (p. [73]-109), and ""The history of Cang-Hy, the present emperour of China pesented [sic] to the Most Christian King by Father J. Bouvet"" ([10], 111 p. at end) each have special t.p.</p><p>Reproduction of originals in British Library and Huntington Library.</p><p>Copies on both reels are imperfect: Reel 172:6 lacks text of ""The history of Cang-Hy"" (111 p.), but includes preliminaries to that text (""Advertisement to the reader"" and ""To the Most Christian King"") bound out of place before ""The present condition of the Muscovite empire ...  Pages [71] and [72] are blank.  Reel 687:6 lacks title page for ""The history of Cang-Hy"" and the relative positions of the 109 p. and 111 p. are reversed.</p><p>Item at 687:6 has Wing number C7428, cancelled in Wing (2nd ed.).</p><p>Other Contributors: Crull, J. d. 1713?; Bouvet, Joachim, 1656-1730.</p> , Early English Books, 1641-1700 (Wing) , <p> 
<object xmlns:pqfn=""http://local/functions"" xmlns:exsl=""http://exslt.org/common"" class=""mstar_link_to_record""><param name=""mstar_record_id_type"" value=""eebo""/><param name=""mstar_record_id"" value=""12258615_57678""/><div class=""mstar_record_link_text"">687:06 The Present condition of the Muscovite empire till the year 1699 in two letters : the first from a gentleman who was conversant with the Muscovite ambassadour in Holland, the second from a person of quality at Vienna, concerning the late Muscovite embassy, his present czarish majesty, the Russian empire and Great-Tartary : with the life of the present emperour of China, by Father J. Bouvet, missionary / by the author of The antient and present state of Muscovy.</div></object></p>"," Russia - History - Peter I, 1689-1725. , Peter I, Emperor of Russia, 1672-1725. , Kangxi, Emperor of China, 1654-1722. , Peter I, Emperor of Russia, 1672-1725. , Kangxi, Emperor of China, 1654-1722. , Russia", History and chronicles,http://ucelinks.cdlib.org:8888/sfx_local?url_ver=Z39.88-2004&amp;rft_val_fmt=info:ofi/fmt:kev:mtx:book&amp;genre=book&amp;sid=ProQ:ProQ%3Aeebo&amp;atitle=&amp;title=The+Present+condition+of+the+Muscovite+empire+till+the+year+1699+in+two+letters+%3A+the+first+from+a+gentleman+who+was+conversant+with+the+Muscovite+ambassadour+in+Holland%2C+the+second+from+a+person+of+quality+at+Vienna%2C+concerning+the+late+Muscovite+embassy%2C+his+present+czarish+majesty%2C+the+Russian+empire+and+Great-Tartary+%3A+with+the+life+of+the+present+emperour+of+China%2C+by+Father+J.+Bouvet%2C+missionary+%2F+by+the+author+of+The+antient+and+present+state+of+Muscovy.&amp;issn=&amp;date=1699-01-01&amp;volume=&amp;issue=&amp;spage=&amp;au=Anonymous&amp;isbn=&amp;jtitle=&amp;btitle=The+Present+condition+of+the+Muscovite+empire+till+the+year+1699+in+two+letters+%3A+the+first+from+a+gentleman+who+was+conversant+with+the+Muscovite+ambassadour+in+Holland%2C+the+second+from+a+person+of+quality+at+Vienna%2C+concerning+the+late+Muscovite+embassy%2C+his+present+czarish+majesty%2C+the+Russian+empire+and+Great-Tartary+%3A+with+the+life+of+the+present+emperour+of+China%2C+by+Father+J.+Bouvet%2C+missionary+%2F+by+the+author+of+The+antient+and+present+state+of+Muscovy.&amp;rft_id=info:eric/172%3A06&amp;rft_id=info:doi/,Early Modern Books
An essay upon the nature and qualities of tea ... by J. Ovington ...,2248532291, 431:15,,Books,"Ovington, J. 1653-1731.", Keyboarded and encoded full text © 2003-2004 Early English Books Online Text Creation Partnership. All Rights Reserved., Book, English, English,," [6], 39 p. :",1699, Books,1699, England,https://search.proquest.com/docview/2248532291?accountid=14496, Illustration," ill. , <p>Reproduction of original in Cambridge University Library.</p> , Early English Books, 1641-1700 (Wing)", Tea - Early works to 1800.," Agriculture, viticulture, texts on hunting, veterinary science",http://ucelinks.cdlib.org:8888/sfx_local?url_ver=Z39.88-2004&amp;rft_val_fmt=info:ofi/fmt:kev:mtx:book&amp;genre=book&amp;sid=ProQ:ProQ%3Aeebo&amp;atitle=&amp;title=An+essay+upon+the+nature+and+qualities+of+tea+...+by+J.+Ovington+...&amp;issn=&amp;date=1699-01-01&amp;volume=&amp;issue=&amp;spage=&amp;au=Ovington%2C+J.+1653-1731.&amp;isbn=&amp;jtitle=&amp;btitle=An+essay+upon+the+nature+and+qualities+of+tea+...+by+J.+Ovington+...&amp;rft_id=info:eric/431%3A15&amp;rft_id=info:doi/,Early Modern Books
