Title,StoreId,AccessionNumber,AlternateTitle,ArticleType,Authors,copyright,documentType,language,languageOfSummary,originalTitle,pages,pubdate,publicationType,year,publisher,DocumentURL,documentFeatures,notes,subjectTerms,subjects,FindACopy,Database
"Travels into divers parts of Europe and Asia, undertaken by the French King's order to discover a new way by land into China containing many curious remarks in natural philosophy, geography, hydrology and history : together with a description of Great Tartary and of the different people who inhabit there / by Father Avril of the Order of the Jesuits ; done out of French ; to which is added, A supplement extracted from Hakluyt and Purchas giving an account of several journeys over land from Russia, Persia, and the Moguls country to China, together with the roads and distances of the places.",2240896832, 832:41, Voyage en divers états d'Europe et d'Asie.,Books,"Avril, Philippe, 1654-1698.", Keyboarded and encoded full text © 2003-2004 Early English Books Online Text Creation Partnership. All Rights Reserved., Book, English, English, Voyage en divers états d'Europe et d'Asie.," [12], 191, [1], 178, [6] p.",1693, Books,1693, England,https://search.proquest.com/docview/2240896832?accountid=14496, Coat of arms," <p>Translation of: Voyage en divers états d'Europe et d'Asie.</p><p>Pages 24-55 photographed from Bodleian Library copy.</p><p>Errata in manuscript: p. [3-5] at end.</p><p>Advertisement on p. [1-2] at end.</p><p>Reproduction of original in Cambridge University Library.</p><p>Other Contributors: Hakluyt, Richard, 1552?-1616.; Purchas, Samuel, 1577?-1626.</p> , Early English Books, 1641-1700 (Wing)"," Middle East - Description and travel. , Asia - Description and travel. , Europe - Description and travel. , Europe - Description and travel - Early works to 1800. , China - Description and travel. , Middle East , Asia , Europe , China"," Travel, topography, maps and navigational manuals",http://ucelinks.cdlib.org:8888/sfx_local?url_ver=Z39.88-2004&amp;rft_val_fmt=info:ofi/fmt:kev:mtx:book&amp;genre=book&amp;sid=ProQ:ProQ%3Aeebo&amp;atitle=&amp;title=Travels+into+divers+parts+of+Europe+and+Asia%2C+undertaken+by+the+French+King%27s+order+to+discover+a+new+way+by+land+into+China+containing+many+curious+remarks+in+natural+philosophy%2C+geography%2C+hydrology+and+history+%3A+together+with+a+description+of+Great+Tartary+and+of+the+different+people+who+inhabit+there+%2F+by+Father+Avril+of+the+Order+of+the+Jesuits+%3B+done+out+of+French+%3B+to+which+is+added%2C+A+supplement+extracted+from+Hakluyt+and+Purchas+giving+an+account+of+several+journeys+over+land+from+Russia%2C+Persia%2C+and+the+Moguls+country+to+China%2C+together+with+the+roads+and+distances+of+the+places.&amp;issn=&amp;date=1693-01-01&amp;volume=&amp;issue=&amp;spage=&amp;au=Avril%2C+Philippe%2C+1654-1698.&amp;isbn=&amp;jtitle=&amp;btitle=Travels+into+divers+parts+of+Europe+and+Asia%2C+undertaken+by+the+French+King%27s+order+to+discover+a+new+way+by+land+into+China+containing+many+curious+remarks+in+natural+philosophy%2C+geography%2C+hydrology+and+history+%3A+together+with+a+description+of+Great+Tartary+and+of+the+different+people+who+inhabit+there+%2F+by+Father+Avril+of+the+Order+of+the+Jesuits+%3B+done+out+of+French+%3B+to+which+is+added%2C+A+supplement+extracted+from+Hakluyt+and+Purchas+giving+an+account+of+several+journeys+over+land+from+Russia%2C+Persia%2C+and+the+Moguls+country+to+China%2C+together+with+the+roads+and+distances+of+the+places.&amp;rft_id=info:eric/832%3A41&amp;rft_id=info:doi/,Early Modern Books
"The voyages and adventures of Ferdinand Mendez Pinto, a Portugal, during his travels for the space of one and twenty years in the kingdoms of Ethiopia, China, Tartaria, Cauchinchina, Calaminham, Siam, Pegu, Japan, and a great part of the East-Indies with a relation and description of most of the places thereof : their religion, laws, riches, customs, and government in the time of peace and war : where he five times suffered shipwrack, was sixteen times sold, and thirteen times made a slave / written originally by himself in the Portugal tongue, and dedicated to the Majesty of Philip King of Spain ; done into English by H.C. Gent.",2240967409, 608:04," Peregrina cam. , Voyages and adventures of Ferdinand Mendez Pinto.",Books,"Pinto, Fernão Mendes, d. 1583.",, Book, English, English," Peregrina cam. , Voyages and adventures of Ferdinand Mendez Pinto."," [14], 326 p.",1692, Books,1692, England,https://search.proquest.com/docview/2240967409?accountid=14496, Chart," <p>Translation of Peregrina cam.</p><p>Reproduction of original in Huntington Library.</p><p>Other Contributors: Cogan, Henry.</p> , <p>The third edition.</p> , Early English Books, 1641-1700 (Wing)"," Voyages and travels. , Asia - Description and travel. , Africa - Description and travel. , Asia , Africa"," Travel, topography, maps and navigational manuals",http://ucelinks.cdlib.org:8888/sfx_local?url_ver=Z39.88-2004&amp;rft_val_fmt=info:ofi/fmt:kev:mtx:book&amp;genre=book&amp;sid=ProQ:ProQ%3Aeebo&amp;atitle=&amp;title=The+voyages+and+adventures+of+Ferdinand+Mendez+Pinto%2C+a+Portugal%2C+during+his+travels+for+the+space+of+one+and+twenty+years+in+the+kingdoms+of+Ethiopia%2C+China%2C+Tartaria%2C+Cauchinchina%2C+Calaminham%2C+Siam%2C+Pegu%2C+Japan%2C+and+a+great+part+of+the+East-Indies+with+a+relation+and+description+of+most+of+the+places+thereof+%3A+their+religion%2C+laws%2C+riches%2C+customs%2C+and+government+in+the+time+of+peace+and+war+%3A+where+he+five+times+suffered+shipwrack%2C+was+sixteen+times+sold%2C+and+thirteen+times+made+a+slave+%2F+written+originally+by+himself+in+the+Portugal+tongue%2C+and+dedicated+to+the+Majesty+of+Philip+King+of+Spain+%3B+done+into+English+by+H.C.+Gent.&amp;issn=&amp;date=1692-01-01&amp;volume=&amp;issue=&amp;spage=&amp;au=Pinto%2C+Fern%C3%A3o+Mendes%2C+d.+1583.&amp;isbn=&amp;jtitle=&amp;btitle=The+voyages+and+adventures+of+Ferdinand+Mendez+Pinto%2C+a+Portugal%2C+during+his+travels+for+the+space+of+one+and+twenty+years+in+the+kingdoms+of+Ethiopia%2C+China%2C+Tartaria%2C+Cauchinchina%2C+Calaminham%2C+Siam%2C+Pegu%2C+Japan%2C+and+a+great+part+of+the+East-Indies+with+a+relation+and+description+of+most+of+the+places+thereof+%3A+their+religion%2C+laws%2C+riches%2C+customs%2C+and+government+in+the+time+of+peace+and+war+%3A+where+he+five+times+suffered+shipwrack%2C+was+sixteen+times+sold%2C+and+thirteen+times+made+a+slave+%2F+written+originally+by+himself+in+the+Portugal+tongue%2C+and+dedicated+to+the+Majesty+of+Philip+King+of+Spain+%3B+done+into+English+by+H.C.+Gent.&amp;rft_id=info:eric/608%3A04&amp;rft_id=info:doi/,Early Modern Books
"The morals of Confucius, a Chinese philosopher who flourished above five hundred years before the coming of our Lord and Saviour Jesus Christ : being one of the most choicest pieces of learning remaining of that nation.",2240956324, 60:08," Confucius Sinarum philosophus. Selections , Lun yu. , Zhong yong. , Da xue.",Books,Confucius., Keyboarded and encoded full text © 2003-2004 Early English Books Online Text Creation Partnership. All Rights Reserved., Book, English, English," Confucius Sinarum philosophus. Selections , Lun yu. , Zhong yong. , Da xue."," [16], 142 p.",1691, Books,1691, England,https://search.proquest.com/docview/2240956324?accountid=14496,," <p>Translated and abridged from the Latin translation of: Three books of Confucius / Prospero Intorcetta, et al. Cf. Pref. of 2nd ed. of The morals of Confucius; Backer-Sommervogel.</p><p>""Licensed, Feb. 25, 1690/1. F. Fraser""</p><p>Advertisement on p. [2]-[15].</p><p>Reproduction of original in British Library.</p><p>Other Contributors: Intorcetta, Prospero, 1626-1696.; Confucius.</p> , Early English Books, 1641-1700 (Wing)"," Philosophy, Chinese. , Ethics - China.", Philosophy and morality,http://ucelinks.cdlib.org:8888/sfx_local?url_ver=Z39.88-2004&amp;rft_val_fmt=info:ofi/fmt:kev:mtx:book&amp;genre=book&amp;sid=ProQ:ProQ%3Aeebo&amp;atitle=&amp;title=The+morals+of+Confucius%2C+a+Chinese+philosopher+who+flourished+above+five+hundred+years+before+the+coming+of+our+Lord+and+Saviour+Jesus+Christ+%3A+being+one+of+the+most+choicest+pieces+of+learning+remaining+of+that+nation.&amp;issn=&amp;date=1691-01-01&amp;volume=&amp;issue=&amp;spage=&amp;au=Confucius.&amp;isbn=&amp;jtitle=&amp;btitle=The+morals+of+Confucius%2C+a+Chinese+philosopher+who+flourished+above+five+hundred+years+before+the+coming+of+our+Lord+and+Saviour+Jesus+Christ+%3A+being+one+of+the+most+choicest+pieces+of+learning+remaining+of+that+nation.&amp;rft_id=info:eric/60%3A08&amp;rft_id=info:doi/,Early Modern Books
"Auctio Millingtoniana picturarum omnigenarum, &amp;c. A collection of extraordinary paintings &amp; limnings, with variety of the finest Italian, French, and other prints, (several of them originals) by the best masters. With many curiosities of the China make, and other artificial rarities. Will be sold by auction, for the diversion and entertainment of the gentlemen, ladies, &amp;c. at Tunbridge-Wells, at the auction coffee-house, by the Lower Walks, near the Wells, on Thursday the 13th of this instant August, 1691. The sale beginning in the morning at eight, and continues till twelve in the forenoon ) [sic] except Prayer-time.) / By Edward Millington.",2240882518, D6:1[92],,Books,"Millington, Edward, d. 1703.",, Book, English, English,," [2], 2+ p.",1691, Books,1691, England,https://search.proquest.com/docview/2240882518?accountid=14496, Chart," <p>Place of publication from Wing.</p><p>Imperfect:  incomplete with catchword ""132AN"" on p. 2.</p><p>Reproduction of original in the British Library.</p> , Tract Supplement"," Art - England - Catalogs - Early works to 1800. , Art auctions - England - London - Early works to 1800.", Art and architecture,http://ucelinks.cdlib.org:8888/sfx_local?url_ver=Z39.88-2004&amp;rft_val_fmt=info:ofi/fmt:kev:mtx:book&amp;genre=book&amp;sid=ProQ:ProQ%3Aeebo&amp;atitle=&amp;title=Auctio+Millingtoniana+picturarum+omnigenarum%2C+%26c.+A+collection+of+extraordinary+paintings+%26+limnings%2C+with+variety+of+the+finest+Italian%2C+French%2C+and+other+prints%2C+%28several+of+them+originals%29+by+the+best+masters.+With+many+curiosities+of+the+China+make%2C+and+other+artificial+rarities.+Will+be+sold+by+auction%2C+for+the+diversion+and+entertainment+of+the+gentlemen%2C+ladies%2C+%26c.+at+Tunbridge-Wells%2C+at+the+auction+coffee-house%2C+by+the+Lower+Walks%2C+near+the+Wells%2C+on+Thursday+the+13th+of+this+instant+August%2C+1691.+The+sale+beginning+in+the+morning+at+eight%2C+and+continues+till+twelve+in+the+forenoon+%29++except+Prayer-time.%29+%2F+By+Edward+Millington.&amp;issn=&amp;date=1691-01-01&amp;volume=&amp;issue=&amp;spage=&amp;au=Millington%2C+Edward%2C+d.+1703.&amp;isbn=&amp;jtitle=&amp;btitle=Auctio+Millingtoniana+picturarum+omnigenarum%2C+%26c.+A+collection+of+extraordinary+paintings+%26+limnings%2C+with+variety+of+the+finest+Italian%2C+French%2C+and+other+prints%2C+%28several+of+them+originals%29+by+the+best+masters.+With+many+curiosities+of+the+China+make%2C+and+other+artificial+rarities.+Will+be+sold+by+auction%2C+for+the+diversion+and+entertainment+of+the+gentlemen%2C+ladies%2C+%26c.+at+Tunbridge-Wells%2C+at+the+auction+coffee-house%2C+by+the+Lower+Walks%2C+near+the+Wells%2C+on+Thursday+the+13th+of+this+instant+August%2C+1691.+The+sale+beginning+in+the+morning+at+eight%2C+and+continues+till+twelve+in+the+forenoon+%29++except+Prayer-time.%29+%2F+By+Edward+Millington.&amp;rft_id=info:eric/D6%3A1&amp;rft_id=info:doi/,Early Modern Books
"A relation of the voyage to Siam Performed by six Jesuits, sent by the French King, to the Indies and China, in the year, 1685. With their astrological observations, and their remarks of natural philosophy, geography, hydrography, and history. Published in the original, by the express orders of His Most Christian Majesty. And now made English, and illustrated with sculptures.",2248553014, 2065:17, Voyage de Siam des pères jésuites.,Books,"Tachard, Guy, 1651-1712.",, Book, English, English, Voyage de Siam des pères jésuites.," [2], 298 [i.e. 308], [12] p., 30 leaves of plates (some folded) :",1688, Books,1688, England,https://search.proquest.com/docview/2248553014?accountid=14496," Chart , Illustration , Map"," maps, plan , <p>A translation of: Tachard, Gui. Voyage de Siam des pères jésuites.</p><p>With an additional engraved title page that reads: The voyage of Siam.</p><p>Page 308 misnumbered 298.</p><p>Reproduction of the original in the British Library.</p> , Early English Books, 1641-1700 (Wing)"," Natural history - Thailand - Early works to 1800. , Thailand - Description and travel - Early works to 1800. , Cape of Good Hope (South Africa) - Description and travel - Early works to 1800. , Java (Indonesia) - Description and travel - Early works to 1800. , Thailand , Cape of Good Hope (South Africa) , Java (Indonesia)"," Science and mathematics , Travel, topography, maps and navigational manuals , History and chronicles",http://ucelinks.cdlib.org:8888/sfx_local?url_ver=Z39.88-2004&amp;rft_val_fmt=info:ofi/fmt:kev:mtx:book&amp;genre=book&amp;sid=ProQ:ProQ%3Aeebo&amp;atitle=&amp;title=A+relation+of+the+voyage+to+Siam+Performed+by+six+Jesuits%2C+sent+by+the+French+King%2C+to+the+Indies+and+China%2C+in+the+year%2C+1685.+With+their+astrological+observations%2C+and+their+remarks+of+natural+philosophy%2C+geography%2C+hydrography%2C+and+history.+Published+in+the+original%2C+by+the+express+orders+of+His+Most+Christian+Majesty.+And+now+made+English%2C+and+illustrated+with+sculptures.&amp;issn=&amp;date=1688-01-01&amp;volume=&amp;issue=&amp;spage=&amp;au=Tachard%2C+Guy%2C+1651-1712.&amp;isbn=&amp;jtitle=&amp;btitle=A+relation+of+the+voyage+to+Siam+Performed+by+six+Jesuits%2C+sent+by+the+French+King%2C+to+the+Indies+and+China%2C+in+the+year%2C+1685.+With+their+astrological+observations%2C+and+their+remarks+of+natural+philosophy%2C+geography%2C+hydrography%2C+and+history.+Published+in+the+original%2C+by+the+express+orders+of+His+Most+Christian+Majesty.+And+now+made+English%2C+and+illustrated+with+sculptures.&amp;rft_id=info:eric/2065%3A17&amp;rft_id=info:doi/,Early Modern Books
"A new history of China containing a description of the most considerable particulars of that vast empire / written by Gabriel Magaillans, of the Society of Jesus ... ; done out of French.",2248552532, 154:12, Doze excelências da China.,Books,"Magalhães, Gabriel de, 1609-1677.", Keyboarded and encoded full text © 2003-2004 Early English Books Online Text Creation Partnership. All Rights Reserved., Book, English, English, Doze excelências da China.," [24], 352 p., 1 folded leaf of plates :",1688, Books,1688, England,https://search.proquest.com/docview/2248552532?accountid=14496," Chart , Illustration , Map"," ill. , <p>Translation of: Doze excelências da China.</p><p>Reproduction of original in British Library.</p> , Early English Books, 1641-1700 (Wing)"," China - Description and travel. , China"," Travel, topography, maps and navigational manuals",http://ucelinks.cdlib.org:8888/sfx_local?url_ver=Z39.88-2004&amp;rft_val_fmt=info:ofi/fmt:kev:mtx:book&amp;genre=book&amp;sid=ProQ:ProQ%3Aeebo&amp;atitle=&amp;title=A+new+history+of+China+containing+a+description+of+the+most+considerable+particulars+of+that+vast+empire+%2F+written+by+Gabriel+Magaillans%2C+of+the+Society+of+Jesus+...+%3B+done+out+of+French.&amp;issn=&amp;date=1688-01-01&amp;volume=&amp;issue=&amp;spage=&amp;au=Magalh%C3%A3es%2C+Gabriel+de%2C+1609-1677.&amp;isbn=&amp;jtitle=&amp;btitle=A+new+history+of+China+containing+a+description+of+the+most+considerable+particulars+of+that+vast+empire+%2F+written+by+Gabriel+Magaillans%2C+of+the+Society+of+Jesus+...+%3B+done+out+of+French.&amp;rft_id=info:eric/154%3A12&amp;rft_id=info:doi/,Early Modern Books
"Relation of the voyage to Siam performed by six Jesuit[s], sent by the French king, to the Indies and China, in the year 1685, with their astrological observations, and their remarks of nattral philosophy, geography, hydrography, and history / published in the original, by the express orders of His Most Christian Majesty ; and now made English, and illustrated with sculptures.",2240891702, 3096:02," Voyage de Siam, des père jésuites.",Books,"Tachard, Guy, 1651-1712.",, Book, English, English," Voyage de Siam, des père jésuites."," [4], 298 [i.e. 308], [12] p., XXX leaves of plates (some folded) :",1688, Books,1688, England,https://search.proquest.com/docview/2240891702?accountid=14496,," ill., maps. , <p>Author suggested by Wing (2nd ed., 1994).</p><p>Includes added, engraved, t.p.</p><p>Reproduction of original in: Beinecke Rare Book and Manuscript Library.</p><p>Other Contributors: Robinson, J.</p> , Early English Books, 1641-1700 (Wing)"," Thailand - Description and travel. , Natural history - Thailand. , Eastern Cape (South Africa) - Description and travel. , Java (Indonesia) - Description and travel. , Missions - Thailand. , Thailand , Eastern Cape (South Africa) , Java (Indonesia)"," Religious , Science and mathematics , Travel, topography, maps and navigational manuals , History and chronicles",http://ucelinks.cdlib.org:8888/sfx_local?url_ver=Z39.88-2004&amp;rft_val_fmt=info:ofi/fmt:kev:mtx:book&amp;genre=book&amp;sid=ProQ:ProQ%3Aeebo&amp;atitle=&amp;title=Relation+of+the+voyage+to+Siam+performed+by+six+Jesuit%2C+sent+by+the+French+king%2C+to+the+Indies+and+China%2C+in+the+year+1685%2C+with+their+astrological+observations%2C+and+their+remarks+of+nattral+philosophy%2C+geography%2C+hydrography%2C+and+history+%2F+published+in+the+original%2C+by+the+express+orders+of+His+Most+Christian+Majesty+%3B+and+now+made+English%2C+and+illustrated+with+sculptures.&amp;issn=&amp;date=1688-01-01&amp;volume=&amp;issue=&amp;spage=&amp;au=Tachard%2C+Guy%2C+1651-1712.&amp;isbn=&amp;jtitle=&amp;btitle=Relation+of+the+voyage+to+Siam+performed+by+six+Jesuit%2C+sent+by+the+French+king%2C+to+the+Indies+and+China%2C+in+the+year+1685%2C+with+their+astrological+observations%2C+and+their+remarks+of+nattral+philosophy%2C+geography%2C+hydrography%2C+and+history+%2F+published+in+the+original%2C+by+the+express+orders+of+His+Most+Christian+Majesty+%3B+and+now+made+English%2C+and+illustrated+with+sculptures.&amp;rft_id=info:eric/3096%3A02&amp;rft_id=info:doi/,Early Modern Books
"A relation of the voyage to Siam performed by six Jesuits, sent by the French King, to the Indies and China, in the year, 1685 : with their astrological observations, and their remarks of natural philosophy, geography, hydrography, and history / published in the original, by the express orders of His Most Christian Majesty ; and now made English, and illustrated with sculptures.",2240874350, 752:18," Voyage de Siam des pères jésuites. , Voyage to Siam. , Voyage of Siam.",Books,"Tachard, Guy, 1651-1712.", Keyboarded and encoded full text © 2003-2004 Early English Books Online Text Creation Partnership. All Rights Reserved., Book, English, English," Voyage de Siam des pères jésuites. , Voyage to Siam. , Voyage of Siam."," [2], 298 [i.e. 308], [12] p., 30 leaves of plates (some folded) :",1688, Books,1688, England,https://search.proquest.com/docview/2240874350?accountid=14496," Chart , Illustration , Map , Plan"," maps, plan. , <p>Marginal notes.</p><p>Errors in paging.</p><p>Running title: A voyage to Siam.</p><p>Title on added engraved t.p.: The voyage of Siam.</p><p>A translation of Voyage de Siam des pères Jesuites by Gui Tachard.</p><p>Reproduction of original in Duke University Library.</p> , Early English Books, 1641-1700 (Wing)"," Natural history - Thailand. , Thailand - Description and travel. , Cape of Good Hope (South Africa) - Description and travel. , Java (Indonesia) - Description and travel. , Thailand , Cape of Good Hope (South Africa) , Java (Indonesia)"," Science and mathematics , Travel, topography, maps and navigational manuals , History and chronicles",http://ucelinks.cdlib.org:8888/sfx_local?url_ver=Z39.88-2004&amp;rft_val_fmt=info:ofi/fmt:kev:mtx:book&amp;genre=book&amp;sid=ProQ:ProQ%3Aeebo&amp;atitle=&amp;title=A+relation+of+the+voyage+to+Siam+performed+by+six+Jesuits%2C+sent+by+the+French+King%2C+to+the+Indies+and+China%2C+in+the+year%2C+1685+%3A+with+their+astrological+observations%2C+and+their+remarks+of+natural+philosophy%2C+geography%2C+hydrography%2C+and+history+%2F+published+in+the+original%2C+by+the+express+orders+of+His+Most+Christian+Majesty+%3B+and+now+made+English%2C+and+illustrated+with+sculptures.&amp;issn=&amp;date=1688-01-01&amp;volume=&amp;issue=&amp;spage=&amp;au=Tachard%2C+Guy%2C+1651-1712.&amp;isbn=&amp;jtitle=&amp;btitle=A+relation+of+the+voyage+to+Siam+performed+by+six+Jesuits%2C+sent+by+the+French+King%2C+to+the+Indies+and+China%2C+in+the+year%2C+1685+%3A+with+their+astrological+observations%2C+and+their+remarks+of+natural+philosophy%2C+geography%2C+hydrography%2C+and+history+%2F+published+in+the+original%2C+by+the+express+orders+of+His+Most+Christian+Majesty+%3B+and+now+made+English%2C+and+illustrated+with+sculptures.&amp;rft_id=info:eric/752%3A18&amp;rft_id=info:doi/,Early Modern Books
"Two journeys of the present Emperour of China into Tartary, in the years 1682, and 1683 with some discoveries made by the Spaniards in the Island of California, in the year 1683.",2248547427, 2945:15, Voyages de l'empereur de la Chine dans la Tartarie.,Books,"Verbiest, Ferdinand, 1623-1688.",, Book, English, English, Voyages de l'empereur de la Chine dans la Tartarie.," [14], 272 p.",1687, Books,1687, England,https://search.proquest.com/docview/2248547427?accountid=14496,," <p>""Journey of the Emperor of China into East-Tartary in the year 1682"" has special t.p. and continuous paging.</p><p>Errata: p. [14].</p><p>Imperfect: stained, tightly bound, and with print show-through.</p><p>Reproduction of original in: Library of Congress.</p> , Early English Books, 1641-1700 (Wing)"," America - Discovery and exploration - Spanish - Early works to 1800. , Soto, Hernando de, ca. 1500-1542. , Florida - Description and travel. , China - Description and travel - Early works to 1800. , China - History - Qing dynasty, 1644-1912. , Kangxi, Emperor of China, 1654-1722. , Soto, Hernando de, ca. 1500-1542. , Kangxi, Emperor of China, 1654-1722. , America , Florida , China"," History and chronicles , Travel, topography, maps and navigational manuals",http://ucelinks.cdlib.org:8888/sfx_local?url_ver=Z39.88-2004&amp;rft_val_fmt=info:ofi/fmt:kev:mtx:book&amp;genre=book&amp;sid=ProQ:ProQ%3Aeebo&amp;atitle=&amp;title=Two+journeys+of+the+present+Emperour+of+China+into+Tartary%2C+in+the+years+1682%2C+and+1683+with+some+discoveries+made+by+the+Spaniards+in+the+Island+of+California%2C+in+the+year+1683.&amp;issn=&amp;date=1687-01-01&amp;volume=&amp;issue=&amp;spage=&amp;au=Verbiest%2C+Ferdinand%2C+1623-1688.&amp;isbn=&amp;jtitle=&amp;btitle=Two+journeys+of+the+present+Emperour+of+China+into+Tartary%2C+in+the+years+1682%2C+and+1683+with+some+discoveries+made+by+the+Spaniards+in+the+Island+of+California%2C+in+the+year+1683.&amp;rft_id=info:eric/2945%3A15&amp;rft_id=info:doi/,Early Modern Books
"A relation of the invasion and conquest of Florida by the Spaniards under the command of Fernando de Soto written in Portuguese by a gentleman of the town of Elvas, now Englished. To which is subjoyned two journeys of the present Emperour of China into Tartary in the years 1682 and 1683 : with some discoveries made by the Spaniards in the island of California, in the year 1683.",2264205515, 1238:08,,Books,Gentleman of the town of Elvas., Keyboarded and encoded full text © 2003-2004 Early English Books Online Text Creation Partnership. All Rights Reserved., Book, English, English,," [12], 272 p.",1686, Books,1686, England,https://search.proquest.com/docview/2264205515?accountid=14496, Chart," <p>Errata: p. [12] (1st grouping)</p><p>""Two journeys of the present Emperour of China into Tartary"" has special t.p., dated 1687.</p><p>Reproduction of original in the British Library.</p> , Early English Books, 1641-1700 (Wing)"," Florida - History - To 1565. , Soto, Hernando de, ca. 1500-1542. , Soto, Hernando de, ca. 1500-1542. , Florida"," History and chronicles , Travel, topography, maps and navigational manuals",http://ucelinks.cdlib.org:8888/sfx_local?url_ver=Z39.88-2004&amp;rft_val_fmt=info:ofi/fmt:kev:mtx:book&amp;genre=book&amp;sid=ProQ:ProQ%3Aeebo&amp;atitle=&amp;title=A+relation+of+the+invasion+and+conquest+of+Florida+by+the+Spaniards+under+the+command+of+Fernando+de+Soto+written+in+Portuguese+by+a+gentleman+of+the+town+of+Elvas%2C+now+Englished.+To+which+is+subjoyned+two+journeys+of+the+present+Emperour+of+China+into+Tartary+in+the+years+1682+and+1683+%3A+with+some+discoveries+made+by+the+Spaniards+in+the+island+of+California%2C+in+the+year+1683.&amp;issn=&amp;date=1686-01-01&amp;volume=&amp;issue=&amp;spage=&amp;au=Gentleman+of+the+town+of+Elvas.&amp;isbn=&amp;jtitle=&amp;btitle=A+relation+of+the+invasion+and+conquest+of+Florida+by+the+Spaniards+under+the+command+of+Fernando+de+Soto+written+in+Portuguese+by+a+gentleman+of+the+town+of+Elvas%2C+now+Englished.+To+which+is+subjoyned+two+journeys+of+the+present+Emperour+of+China+into+Tartary+in+the+years+1682+and+1683+%3A+with+some+discoveries+made+by+the+Spaniards+in+the+island+of+California%2C+in+the+year+1683.&amp;rft_id=info:eric/1238%3A08&amp;rft_id=info:doi/,Early Modern Books
