Title,StoreId,AccessionNumber,AlternateTitle,ArticleType,Authors,copyright,documentType,language,languageOfSummary,originalTitle,pages,pubdate,publicationType,year,publisher,DocumentURL,documentFeatures,notes,subjectTerms,subjects,FindACopy,Database
"An embassy from the East-India Company of the United Provinces, to the Grand Tartar Cham, Emperour of China delivered by their Excell[en]cies, Peter de Goyer and Jacob de Keyzer, at his imperial city of Peking : wherein the cities ... ports, rivers, &amp;c. in their passages from Canton to Peking are ingeniously described / by Mr. John Nieuhoff ... ; also an epistle of Father John Adams ... concerning the whole negotiation ; with an appendix of several remarks taken out of Father Athanasius Kircher ; Englished and set forth with their several sculptures, by John Ogilby, Esq. ...",2240876161, 430:19," Gezantschap der Neerlandtsche Oost-Indische Compagnie aan den grooten Tartarischen Cham, den tegenwoordigen keizer van China. , China monumentis.",Books,"Nieuhof, Johannes, 1618-1672.",, Book, English, English," Gezantschap der Neerlandtsche Oost-Indische Compagnie aan den grooten Tartarischen Cham, den tegenwoordigen keizer van China. , China monumentis."," [13], 327 [i.e. 307], 18 p., [2], 106, [2] p., [13] leaves of plates :",1669, Books,1669, England,https://search.proquest.com/docview/2240876161?accountid=14496," Chart , Illustration , Map , Portrait , Printers' mark - colophon"," ill., map, ports. , <p>Translation of: Gezantschap der Neerlandtsche Oost-Indische Compagnie aan den grooten Tartarischen Cham, den tegenwoordigen keizer van China.</p><p>Added engraved t.p.</p><p>""A narrative of the success of an embassage sent by John Maatzuyker de Badem, General of Batavia, unto the emperour of China &amp; Tartary, the 20 of July 1655 ... written by a Jesuite in those parts"" (18 p.) includes the epistle of Father John Adam.</p><p>Pt. 1: many pages are stained, faded, or tightly bound in filmed copy. Beginning-p. 89 photographed from Cambridge University Library copy and inserted at the end.</p><p>Reproduction of original in Huntington Library.</p><p>Other Contributors: Goyer, Pieter de.; Keizer, Jacob de.; Kircher, Athanasius, 1602-1680.; Ogilby, John, 1600-1676.; Schall von Bell, Johann Adam, 1592?-1666.</p> , Early English Books, 1641-1700 (Wing)"," Nederlandsche Oost-Indische Compagnie. , China - Description and travel. , China - Commerce - Netherlands. , Netherlands - Commerce - China. , China , Netherlands"," Economics , Travel, topography, maps and navigational manuals , History and chronicles",http://ucelinks.cdlib.org:8888/sfx_local?url_ver=Z39.88-2004&amp;rft_val_fmt=info:ofi/fmt:kev:mtx:book&amp;genre=book&amp;sid=ProQ:ProQ%3Aeebo&amp;atitle=&amp;title=An+embassy+from+the+East-India+Company+of+the+United+Provinces%2C+to+the+Grand+Tartar+Cham%2C+Emperour+of+China+delivered+by+their+Excellcies%2C+Peter+de+Goyer+and+Jacob+de+Keyzer%2C+at+his+imperial+city+of+Peking+%3A+wherein+the+cities+...+ports%2C+rivers%2C+%26c.+in+their+passages+from+Canton+to+Peking+are+ingeniously+described+%2F+by+Mr.+John+Nieuhoff+...+%3B+also+an+epistle+of+Father+John+Adams+...+concerning+the+whole+negotiation+%3B+with+an+appendix+of+several+remarks+taken+out+of+Father+Athanasius+Kircher+%3B+Englished+and+set+forth+with+their+several+sculptures%2C+by+John+Ogilby%2C+Esq.+...&amp;issn=&amp;date=1669-01-01&amp;volume=&amp;issue=&amp;spage=&amp;au=Nieuhof%2C+Johannes%2C+1618-1672.&amp;isbn=&amp;jtitle=&amp;btitle=An+embassy+from+the+East-India+Company+of+the+United+Provinces%2C+to+the+Grand+Tartar+Cham%2C+Emperour+of+China+delivered+by+their+Excellcies%2C+Peter+de+Goyer+and+Jacob+de+Keyzer%2C+at+his+imperial+city+of+Peking+%3A+wherein+the+cities+...+ports%2C+rivers%2C+%26c.+in+their+passages+from+Canton+to+Peking+are+ingeniously+described+%2F+by+Mr.+John+Nieuhoff+...+%3B+also+an+epistle+of+Father+John+Adams+...+concerning+the+whole+negotiation+%3B+with+an+appendix+of+several+remarks+taken+out+of+Father+Athanasius+Kircher+%3B+Englished+and+set+forth+with+their+several+sculptures%2C+by+John+Ogilby%2C+Esq.+...&amp;rft_id=info:eric/430%3A19&amp;rft_id=info:doi/,Early Modern Books
"The worlds wonder! or, The prophetical fish. Being a full description of this monster, its length &amp; breadth with predictions on it. As it was taken by fisher-men in the port of Cucanga, neer the province and kingdom of China, in the year 1664. and sent to the emperour of Germany, and from thence convey'd to his Royal Majesty, the king of Greeat Brittain, &amp;c. To the tune of, When stormy winds do blow.",2240881238, 2661:38,,Books,Anonymous, Keyboarded and encoded full text © 2003-2004 Early English Books Online Text Creation Partnership. All Rights Reserved., Book, English, English,, 3 leaves ([3] p.) :,1666, Books,1666, England,https://search.proquest.com/docview/2240881238?accountid=14496, Illustration," ill. , <p>Contains two illustrations.</p><p>Second leaf has separate imprint, and appears to belong to a different item.</p><p>Third leaf contains imprint, and has title: The second part, to the same tune.</p><p>Reproduction of original in: Bodleian Library.</p> , Early English Books, 1641-1700 (Wing)"," Great Britain - Politics and government - Poetry. , Charles II, King of England, 1630-1685 - Poetry. , Broadsides - England - London - 17th century. , Charles II, King of England, 1630-1685 , Great Britain"," Poetry , History and chronicles",http://ucelinks.cdlib.org:8888/sfx_local?url_ver=Z39.88-2004&amp;rft_val_fmt=info:ofi/fmt:kev:mtx:book&amp;genre=book&amp;sid=ProQ:ProQ%3Aeebo&amp;atitle=&amp;title=The+worlds+wonder%21+or%2C+The+prophetical+fish.+Being+a+full+description+of+this+monster%2C+its+length+%26+breadth+with+predictions+on+it.+As+it+was+taken+by+fisher-men+in+the+port+of+Cucanga%2C+neer+the+province+and+kingdom+of+China%2C+in+the+year+1664.+and+sent+to+the+emperour+of+Germany%2C+and+from+thence+convey%27d+to+his+Royal+Majesty%2C+the+king+of+Greeat+Brittain%2C+%26c.+To+the+tune+of%2C+When+stormy+winds+do+blow.&amp;issn=&amp;date=1666-01-01&amp;volume=&amp;issue=&amp;spage=&amp;au=Anonymous&amp;isbn=&amp;jtitle=&amp;btitle=The+worlds+wonder%21+or%2C+The+prophetical+fish.+Being+a+full+description+of+this+monster%2C+its+length+%26+breadth+with+predictions+on+it.+As+it+was+taken+by+fisher-men+in+the+port+of+Cucanga%2C+neer+the+province+and+kingdom+of+China%2C+in+the+year+1664.+and+sent+to+the+emperour+of+Germany%2C+and+from+thence+convey%27d+to+his+Royal+Majesty%2C+the+king+of+Greeat+Brittain%2C+%26c.+To+the+tune+of%2C+When+stormy+winds+do+blow.&amp;rft_id=info:eric/2661%3A38&amp;rft_id=info:doi/,Early Modern Books
"The life of Tamerlane the Great with his wars against the Duke of Mosco, the King of China, Bajazet the great Turk, the Sultan of Egypt, the King of Persia, and some others, carried on with a continued series of success from the first to the last. Wherein are rare examples of heathenish piety, prudence, magnanimity, mercy, liberality, humility, justice, temperance, and valour. By Sa. Clarke, late pastor in St. Bennet Fink, London.",2240931165, 2331:09,,Books,"Clarke, Samuel, 1599-1682.",, Book, English, English,," [2], 57, [1] p., [1] leaf of plates :",1664, Books,1664, England,https://search.proquest.com/docview/2240931165?accountid=14496," Coat of arms , Portrait , Printers' mark - colophon"," port. , <p>Date of publication from Wing.</p><p>Reproduction of original in the Newberry Library, Chicago, Illinois.</p> , Early English Books, 1641-1700 (Wing)"," Timur, 1336-1405 - Early works to 1800. , Timur, 1336-1405"," Literature , History and chronicles",http://ucelinks.cdlib.org:8888/sfx_local?url_ver=Z39.88-2004&amp;rft_val_fmt=info:ofi/fmt:kev:mtx:book&amp;genre=book&amp;sid=ProQ:ProQ%3Aeebo&amp;atitle=&amp;title=The+life+of+Tamerlane+the+Great+with+his+wars+against+the+Duke+of+Mosco%2C+the+King+of+China%2C+Bajazet+the+great+Turk%2C+the+Sultan+of+Egypt%2C+the+King+of+Persia%2C+and+some+others%2C+carried+on+with+a+continued+series+of+success+from+the+first+to+the+last.+Wherein+are+rare+examples+of+heathenish+piety%2C+prudence%2C+magnanimity%2C+mercy%2C+liberality%2C+humility%2C+justice%2C+temperance%2C+and+valour.+By+Sa.+Clarke%2C+late+pastor+in+St.+Bennet+Fink%2C+London.&amp;issn=&amp;date=1664-01-01&amp;volume=&amp;issue=&amp;spage=&amp;au=Clarke%2C+Samuel%2C+1599-1682.&amp;isbn=&amp;jtitle=&amp;btitle=The+life+of+Tamerlane+the+Great+with+his+wars+against+the+Duke+of+Mosco%2C+the+King+of+China%2C+Bajazet+the+great+Turk%2C+the+Sultan+of+Egypt%2C+the+King+of+Persia%2C+and+some+others%2C+carried+on+with+a+continued+series+of+success+from+the+first+to+the+last.+Wherein+are+rare+examples+of+heathenish+piety%2C+prudence%2C+magnanimity%2C+mercy%2C+liberality%2C+humility%2C+justice%2C+temperance%2C+and+valour.+By+Sa.+Clarke%2C+late+pastor+in+St.+Bennet+Fink%2C+London.&amp;rft_id=info:eric/2331%3A09&amp;rft_id=info:doi/,Early Modern Books
"The voyages and adventures of Ferdinand Mendez Pinto, a Portugal: during his travels for the space of one and twenty years in the kingdoms of Ethiopia, China, Tartaria, Cauchinchina, Calaminham, Siam, Pegu, Japan, and a great part of the East-Indies. With a relation and description of most of the places thereof; their religion, laws, riches, customs, and government in the time of peace and war. Where he five times suffered shipwrack, was sixteen times sold, and thirteen times made a slave. Written originally by himself in the Portugal tongue, and dedicated to the Majesty of Philip King of Spain. Done into English by H.C. Gent.",2240960407, 1782:14, Peregrina cam.,Books,"Pinto, Fernão Mendes, d. 1583.",, Book, English, English, Peregrina cam.," [14], 326 p.",1663, Books,1663, England,https://search.proquest.com/docview/2240960407?accountid=14496, Chart," <p>A translation, by Henry Cogan, of: Pinto, Fernão Mendes. Peregrina cam.</p><p>Page numbers 232-239 omitted in pagination; text is apparently continuous.</p><p>Reproduction of the original in the British Library.</p><p>Other Contributors: Cogan, Henry.</p> , Early English Books, 1641-1700 (Wing)"," Voyages and travels - Early works to 1800. , Asia - Description and travel - Early works to 1800. , Asia"," Travel, topography, maps and navigational manuals",http://ucelinks.cdlib.org:8888/sfx_local?url_ver=Z39.88-2004&amp;rft_val_fmt=info:ofi/fmt:kev:mtx:book&amp;genre=book&amp;sid=ProQ:ProQ%3Aeebo&amp;atitle=&amp;title=The+voyages+and+adventures+of+Ferdinand+Mendez+Pinto%2C+a+Portugal%3A+during+his+travels+for+the+space+of+one+and+twenty+years+in+the+kingdoms+of+Ethiopia%2C+China%2C+Tartaria%2C+Cauchinchina%2C+Calaminham%2C+Siam%2C+Pegu%2C+Japan%2C+and+a+great+part+of+the+East-Indies.+With+a+relation+and+description+of+most+of+the+places+thereof%3B+their+religion%2C+laws%2C+riches%2C+customs%2C+and+government+in+the+time+of+peace+and+war.+Where+he+five+times+suffered+shipwrack%2C+was+sixteen+times+sold%2C+and+thirteen+times+made+a+slave.+Written+originally+by+himself+in+the+Portugal+tongue%2C+and+dedicated+to+the+Majesty+of+Philip+King+of+Spain.+Done+into+English+by+H.C.+Gent.&amp;issn=&amp;date=1663-01-01&amp;volume=&amp;issue=&amp;spage=&amp;au=Pinto%2C+Fern%C3%A3o+Mendes%2C+d.+1583.&amp;isbn=&amp;jtitle=&amp;btitle=The+voyages+and+adventures+of+Ferdinand+Mendez+Pinto%2C+a+Portugal%3A+during+his+travels+for+the+space+of+one+and+twenty+years+in+the+kingdoms+of+Ethiopia%2C+China%2C+Tartaria%2C+Cauchinchina%2C+Calaminham%2C+Siam%2C+Pegu%2C+Japan%2C+and+a+great+part+of+the+East-Indies.+With+a+relation+and+description+of+most+of+the+places+thereof%3B+their+religion%2C+laws%2C+riches%2C+customs%2C+and+government+in+the+time+of+peace+and+war.+Where+he+five+times+suffered+shipwrack%2C+was+sixteen+times+sold%2C+and+thirteen+times+made+a+slave.+Written+originally+by+himself+in+the+Portugal+tongue%2C+and+dedicated+to+the+Majesty+of+Philip+King+of+Spain.+Done+into+English+by+H.C.+Gent.&amp;rft_id=info:eric/1782%3A14&amp;rft_id=info:doi/,Early Modern Books
"The life of Dom John de Castro, the fourth vice-roy of India wherein are seen the Portuguese's voyages to the East-Indies, their discoveries and conquests there, the form of government, commerce, and discipline of warr in the east, and the topography of all India and China : containing also a particular relation of the most famous siege of Dio, with a map to illustrate it / by Jacinto Freire de Andrada, written in Portuguese ; and by Sr Peter Wyche, Kt., translated into English.",2240959929, 144:03," Vida de Dom João de Castro, quarto viso-rey da India.",Books,"Freire de Andrade, Jacinto, 1597-1657.", Keyboarded and encoded full text © 2003-2004 Early English Books Online Text Creation Partnership. All Rights Reserved., Book, English, English," Vida de Dom João de Castro, quarto viso-rey da India."," [23], 272, [19] p., [3] leaves of plates :",1663, Books,1663, England,https://search.proquest.com/docview/2240959929?accountid=14496," Chart , Illustration , Plan"," ill., folded map, port. , <p>Translation of: Vida de Dom João de Castro, quarto viso-rey da India.</p><p>Errata: p. [19] at end.</p><p>Reproduction of original in Harvard University Libraries.</p><p>Marginal notes.</p><p>Includes index.</p><p>Other Contributors: Wyche, Peter, Sir, 1628-1699?</p> , Early English Books, 1641-1700 (Wing)"," Castro, João de, 1500-1548. , Goa, Daman and Diu (India) - History. , Viceroys - India - Goa, Daman and Diu. , Castro, João de, 1500-1548. , Goa, Daman and Diu (India)", History and chronicles,http://ucelinks.cdlib.org:8888/sfx_local?url_ver=Z39.88-2004&amp;rft_val_fmt=info:ofi/fmt:kev:mtx:book&amp;genre=book&amp;sid=ProQ:ProQ%3Aeebo&amp;atitle=&amp;title=The+life+of+Dom+John+de+Castro%2C+the+fourth+vice-roy+of+India+wherein+are+seen+the+Portuguese%27s+voyages+to+the+East-Indies%2C+their+discoveries+and+conquests+there%2C+the+form+of+government%2C+commerce%2C+and+discipline+of+warr+in+the+east%2C+and+the+topography+of+all+India+and+China+%3A+containing+also+a+particular+relation+of+the+most+famous+siege+of+Dio%2C+with+a+map+to+illustrate+it+%2F+by+Jacinto+Freire+de+Andrada%2C+written+in+Portuguese+%3B+and+by+Sr+Peter+Wyche%2C+Kt.%2C+translated+into+English.&amp;issn=&amp;date=1663-01-01&amp;volume=&amp;issue=&amp;spage=&amp;au=Freire+de+Andrade%2C+Jacinto%2C+1597-1657.&amp;isbn=&amp;jtitle=&amp;btitle=The+life+of+Dom+John+de+Castro%2C+the+fourth+vice-roy+of+India+wherein+are+seen+the+Portuguese%27s+voyages+to+the+East-Indies%2C+their+discoveries+and+conquests+there%2C+the+form+of+government%2C+commerce%2C+and+discipline+of+warr+in+the+east%2C+and+the+topography+of+all+India+and+China+%3A+containing+also+a+particular+relation+of+the+most+famous+siege+of+Dio%2C+with+a+map+to+illustrate+it+%2F+by+Jacinto+Freire+de+Andrada%2C+written+in+Portuguese+%3B+and+by+Sr+Peter+Wyche%2C+Kt.%2C+translated+into+English.&amp;rft_id=info:eric/144%3A03&amp;rft_id=info:doi/,Early Modern Books
"A prospect of the most famous parts of the vvorld Viz. Asia, 3 Affrica, 5 Europe, 7 America, 9 With these kingdomes therein contained; Grecia, 11 Romane Empire, 13 Germanie, 15 Bohemia, 17 France, 19 Belgia, 21 Spaine, 23 Italie, 25 Hungarie, 27 Denmarke, 29 Poland, 31 Persia, 33 Turkish Empire, 35 Kingdome of China, 37 Tartaria, 39 Sommer Ilands, 41 Civill Warres, in England, Wales, and Ireland, You shall find placed in the beginning of the second book marked with these [3 asterisks in triangle formation] and (5) together with all the provinces, counties, and shires, contained in that large theater of Great Britaines empire. Performed by John Speed.",2248548933, 2062:05,,Books,"Speed, John, 1552?-1629.",, Book, English, English,," [2], 44, [3], 94, [2], 99-126, [2], 131-132, [2], 137-146, [10] p., [90] plates",1662, Books,1662, England,https://search.proquest.com/docview/2248548933?accountid=14496," Chart , Coat of arms , Illustration , Map , Plan , Portrait"," <p>Text is continuous despite pagination.</p><p>Port. = frontis.</p><p>With an index.</p><p>The maps are engraved mainly by Abraham Goos and Dirck Gryp.</p><p>Reproduction of the original in the British Library.</p><p>Other Contributors: Goos, Abraham; Gryp, Dirck</p> , Early English Books, 1641-1700 (Wing)"," Geography - Early works to 1800. , Atlases, English - Early works to 1800."," Travel, topography, maps and navigational manuals",http://ucelinks.cdlib.org:8888/sfx_local?url_ver=Z39.88-2004&amp;rft_val_fmt=info:ofi/fmt:kev:mtx:book&amp;genre=book&amp;sid=ProQ:ProQ%3Aeebo&amp;atitle=&amp;title=A+prospect+of+the+most+famous+parts+of+the+vvorld+Viz.+Asia%2C+3+Affrica%2C+5+Europe%2C+7+America%2C+9+With+these+kingdomes+therein+contained%3B+Grecia%2C+11+Romane+Empire%2C+13+Germanie%2C+15+Bohemia%2C+17+France%2C+19+Belgia%2C+21+Spaine%2C+23+Italie%2C+25+Hungarie%2C+27+Denmarke%2C+29+Poland%2C+31+Persia%2C+33+Turkish+Empire%2C+35+Kingdome+of+China%2C+37+Tartaria%2C+39+Sommer+Ilands%2C+41+Civill+Warres%2C+in+England%2C+Wales%2C+and+Ireland%2C+You+shall+find+placed+in+the+beginning+of+the+second+book+marked+with+these++and+%285%29+together+with+all+the+provinces%2C+counties%2C+and+shires%2C+contained+in+that+large+theater+of+Great+Britaines+empire.+Performed+by+John+Speed.&amp;issn=&amp;date=1662-01-01&amp;volume=&amp;issue=&amp;spage=&amp;au=Speed%2C+John%2C+1552%3F-1629.&amp;isbn=&amp;jtitle=&amp;btitle=A+prospect+of+the+most+famous+parts+of+the+vvorld+Viz.+Asia%2C+3+Affrica%2C+5+Europe%2C+7+America%2C+9+With+these+kingdomes+therein+contained%3B+Grecia%2C+11+Romane+Empire%2C+13+Germanie%2C+15+Bohemia%2C+17+France%2C+19+Belgia%2C+21+Spaine%2C+23+Italie%2C+25+Hungarie%2C+27+Denmarke%2C+29+Poland%2C+31+Persia%2C+33+Turkish+Empire%2C+35+Kingdome+of+China%2C+37+Tartaria%2C+39+Sommer+Ilands%2C+41+Civill+Warres%2C+in+England%2C+Wales%2C+and+Ireland%2C+You+shall+find+placed+in+the+beginning+of+the+second+book+marked+with+these++and+%285%29+together+with+all+the+provinces%2C+counties%2C+and+shires%2C+contained+in+that+large+theater+of+Great+Britaines+empire.+Performed+by+John+Speed.&amp;rft_id=info:eric/2062%3A05&amp;rft_id=info:doi/,Early Modern Books
"The voyages &amp; travels of the ambassadors sent by Frederick Duke of Holstein, to the great Duke of Muscovy, and the King of Persia begun in the year M.DC.XXXIII, and finish'd in M.DC.XXXIX : containing a compleat history of Muscovy, Tartary, Persia, and other adjacent countries : with several publick transactions reaching neer the present times, in VII books : whereto are added the Travels of John Albert de Mandelslo, (a gentleman belonging to the embassy) from Persia, into the East-Indies containing a particular description of Indosthan, the Mogul's Empire, the oriental ilands [sic], Japan, China, &amp;c. and the revolutions which happened in those countries, within these few years, in III books : the whole work illustrated with divers accurate mapps, and figures / written originally by Adam Olearius ... ; faithfully rendred into English, by John Davies ...",2240960423, 770:16," Offt begehrte Beschreibung der newen orientalischen Reise. , Morgenländische Reyse-Beschreibung. , Voyages & travels of J. Albert de Mandelslo. , Voyages and travels of J. Albert de Mandelslo.",Books,"Olearius, Adam, 1603-1671.",, Book, English, English," Offt begehrte Beschreibung der newen orientalischen Reise. , Morgenländische Reyse-Beschreibung. , Voyages & travels of J. Albert de Mandelslo. , Voyages and travels of J. Albert de Mandelslo."," 2 v. ([26], 424; [4], 287, [10] p., 4 leaves of plates) :",1662, Books,1662, England,https://search.proquest.com/docview/2240960423?accountid=14496," Chart , Coat of arms , Illustration , Map , Portrait , Printers' mark - title page"," ports., folded maps. , <p>Errata: p. [10] at end.</p><p>Added t.p. on p. [425]: ""The voyages &amp; travels of J. Albert de Mandelslo ... into the East-Indies ..."", London : Printed for Tho. Dring, and J. Starkey ..., 1662.</p><p>""He [Frederick] employ'd in this embassy Philip Crusius ... and Otton Brugman."" cf. p. 1.</p><p>Translation of: Offt begehrte Beschreibung der newen orientalischen Reise.</p><p>Reproduction of original in Huntington Library.</p><p>Other Contributors: Mandelslo, Johann Albrecht von, 1616-1644.; Davies, John, 1625-1693.</p> , Early English Books, 1641-1700 (Wing)"," Crusius, Philipp, 1597-1676. , Brüggemann, Otto, 1600-1640. , Voyages and travels. , Asia - Description and travel. , East Indies - Description and travel. , Iran - Description and travel. , Crusius, Philipp, 1597-1676. , Brüggemann, Otto, 1600-1640. , Asia , East Indies , Iran"," News books , History and chronicles , Travel, topography, maps and navigational manuals",http://ucelinks.cdlib.org:8888/sfx_local?url_ver=Z39.88-2004&amp;rft_val_fmt=info:ofi/fmt:kev:mtx:book&amp;genre=book&amp;sid=ProQ:ProQ%3Aeebo&amp;atitle=&amp;title=The+voyages+%26+travels+of+the+ambassadors+sent+by+Frederick+Duke+of+Holstein%2C+to+the+great+Duke+of+Muscovy%2C+and+the+King+of+Persia+begun+in+the+year+M.DC.XXXIII%2C+and+finish%27d+in+M.DC.XXXIX+%3A+containing+a+compleat+history+of+Muscovy%2C+Tartary%2C+Persia%2C+and+other+adjacent+countries+%3A+with+several+publick+transactions+reaching+neer+the+present+times%2C+in+VII+books+%3A+whereto+are+added+the+Travels+of+John+Albert+de+Mandelslo%2C+%28a+gentleman+belonging+to+the+embassy%29+from+Persia%2C+into+the+East-Indies+containing+a+particular+description+of+Indosthan%2C+the+Mogul%27s+Empire%2C+the+oriental+ilands+%2C+Japan%2C+China%2C+%26c.+and+the+revolutions+which+happened+in+those+countries%2C+within+these+few+years%2C+in+III+books+%3A+the+whole+work+illustrated+with+divers+accurate+mapps%2C+and+figures+%2F+written+originally+by+Adam+Olearius+...+%3B+faithfully+rendred+into+English%2C+by+John+Davies+...&amp;issn=&amp;date=1662-01-01&amp;volume=&amp;issue=&amp;spage=&amp;au=Olearius%2C+Adam%2C+1603-1671.&amp;isbn=&amp;jtitle=&amp;btitle=The+voyages+%26+travels+of+the+ambassadors+sent+by+Frederick+Duke+of+Holstein%2C+to+the+great+Duke+of+Muscovy%2C+and+the+King+of+Persia+begun+in+the+year+M.DC.XXXIII%2C+and+finish%27d+in+M.DC.XXXIX+%3A+containing+a+compleat+history+of+Muscovy%2C+Tartary%2C+Persia%2C+and+other+adjacent+countries+%3A+with+several+publick+transactions+reaching+neer+the+present+times%2C+in+VII+books+%3A+whereto+are+added+the+Travels+of+John+Albert+de+Mandelslo%2C+%28a+gentleman+belonging+to+the+embassy%29+from+Persia%2C+into+the+East-Indies+containing+a+particular+description+of+Indosthan%2C+the+Mogul%27s+Empire%2C+the+oriental+ilands+%2C+Japan%2C+China%2C+%26c.+and+the+revolutions+which+happened+in+those+countries%2C+within+these+few+years%2C+in+III+books+%3A+the+whole+work+illustrated+with+divers+accurate+mapps%2C+and+figures+%2F+written+originally+by+Adam+Olearius+...+%3B+faithfully+rendred+into+English%2C+by+John+Davies+...&amp;rft_id=info:eric/770%3A16&amp;rft_id=info:doi/,Early Modern Books
